anno	cantanti	titolo	lyrics	sesso	playlist_name	playlist_img	track_name	track_uri	artist_name	album_name	album_img	track_popularity	danceability	energy	key	loudness	mode	speechiness	acousticness	instrumentalness	liveness	valence	tempo	duration_ms	time_signature	key_mode
1958	Domenico Modugno, Johnny Dorelli	Nel blu dipinto di blu	volare oh oh cantare oh oh oh oh let's fly way up to the cloud away from the maddening crowd we can sing in the glow of a star that i know of whew lovers enjoy peace of mind let us leave the confusion and all disillusion behind just like birds of a feather a rainbow together we'll find volare oh oh cantare oh oh oh oh no wonder my happy heart sings your love has given me wings sometimes the world is a valley of heartaches and tears and in the hustle and bustle no sunshine appears but you and i have our love always there to remind us there is a way we can leave all the shadows behind us volare oh oh volare oh volare oh oh cantare cantare oh oh oh oh oh cantare oh oh no wonder my happy heart sings your love has given me wings no wonder my happy heart sings your love has given me wings my happy heart sings volare oh oh	0	Festival di Sanremo: Tutte le canzoni vincitrici (All Winners)	https://mosaic.scdn.co/640/84dfa22bd88d33fcb4dbae6c7464ec3d3ed5e87db7dc55c8d03f0d69ac26609c205b314714dfd087e39a814b141f80791d27af68a41f8e4b6c84bdf4f18d8f92e925c89caacf65f51925c0a69412abb2	Nel blu dipinto di blu - Volare	0VQ3MYFzlP7v9MW0nfDqEO	Johnny Dorelli	Il festival di Sanremo: Charts 1958	https://i.scdn.co/image/d267be1f828150125e5644cd52aa75c57ed87a1f	0	0.457	0.141	A#	-17.381	major	0.0522	0.983	5.64e-4	0.162	0.413	122.125	187773	4	A# major
1962	Domenico Modugno, Claudio Villa	Addio… addio	I miei sorrisi e i tuoi si sono spenti noi camminiamo insieme e siamo soli ci restano soltanto lunghi silenzi che vogliono dire... addio... addio... il nostro amore acqua di mare e' diventata sale le nostre labbra inaridite non hanno piu' parole guardami... guardami lo sai che non è vero non è vero ch'e' finito il nostro amore addio addio addio addio guardami... guardami ascoltami fermati non è vero perché tu stai piangendo perché noi lo sappiamo che ci vogliamo bene che ci vogliamo bene e ci lasciamo addio addio addio addiooooo	0	Festival di Sanremo: Tutte le canzoni vincitrici (All Winners)	https://mosaic.scdn.co/640/84dfa22bd88d33fcb4dbae6c7464ec3d3ed5e87db7dc55c8d03f0d69ac26609c205b314714dfd087e39a814b141f80791d27af68a41f8e4b6c84bdf4f18d8f92e925c89caacf65f51925c0a69412abb2	Addio...addio	1YG0S83N2nnx3OHJ1xawKS	Claudio Villa	Claudio Villa ed i suoi più grandi successi (78 canzoni)	https://i.scdn.co/image/7bae70f82a5c92e47632f99dfe59aa1bb2b831db	5	0.319	0.169	D	-10.671	minor	0.03	0.986	2e-5	0.0901	0.102	70.635	250840	4	D minor
1966	Domenico Modugno, Gigliola Cinquetti	Dio come ti amo	nel cielo passano le nuvole che vanno verso il mare sembrano fazzoletti bianchi che salutano il nostro amore dio come ti amo non e possibile avere tra le braccia tanta felicita' baciare le tue labbra che odorano di vento noi due innamorati come nessuno al mondo dio come ti amo mi vien da piangere in tutta la mia vita non ho provato mai un bene cosi' caro un bene cosi' vero chi puo' fermare il fiume che corre verso il mare le rondini nel cielo che vanno verso il sole chi puo fermar l'amore l'amore mio per te dio come ti amo dio come ti amo dio come ti amo dio come ti amo	0.5	Festival di Sanremo: Tutte le canzoni vincitrici (All Winners)	https://mosaic.scdn.co/640/84dfa22bd88d33fcb4dbae6c7464ec3d3ed5e87db7dc55c8d03f0d69ac26609c205b314714dfd087e39a814b141f80791d27af68a41f8e4b6c84bdf4f18d8f92e925c89caacf65f51925c0a69412abb2	Dio, Come Ti Amo	4YN1yE15DfJpOEtIO2uUI4	Gigliola Cinquetti	La Regina Di San Remo	https://i.scdn.co/image/8e77ca1d756a472928a2e64f3e1bd5c601a00165	35	0.364	0.288	F	-7.61	minor	0.0295	0.85	5.56e-6	0.361	0.143	95.439	198160	4	F minor
1972	Nicola Di Bari	I giorni dell’arcobaleno	erano i giorni dell'arcobaleno finito l'inverno tornava il sereno e tu con negli occhi la luna e le stelle sentivi una mano sfiorare la tua pelle e mentre impazzivi al profumo dei fiori la notte si accese di mille colori distesa sull'erba come una che sogna giacesti bambina ti alzasti già donna tu adesso ti vedi grande di più sei diventata più forte e sicura e iniziata la avventura ormai sono bambine le amiche di prima che si ritrovano in gruppo a giocare e sognano ancora su un raggio di luna vivi la vita di donna importante perché a sedici anni ai già avuto un amante ma un giorno saprai che ogni donna è matura all'epoca giusta e con giusta misura e in questa tua corsa incontro all'amore ti lasci alle spalle il tempo migliore erano i giorni dell'arcobaleno finito l'inverno tornava il sereno	0	Festival di Sanremo: Tutte le canzoni vincitrici (All Winners)	https://mosaic.scdn.co/640/84dfa22bd88d33fcb4dbae6c7464ec3d3ed5e87db7dc55c8d03f0d69ac26609c205b314714dfd087e39a814b141f80791d27af68a41f8e4b6c84bdf4f18d8f92e925c89caacf65f51925c0a69412abb2	I Giorni Del Arcobaleno (Los Dias Del Arcoiris)	0oNTJpKhjSGg4XCmaZtrRl	Nicola Di Bari	Serie Platino	https://i.scdn.co/image/9643dd78a32adedcd9ab2e313335cc70b9ab12a6	9	0.472	0.218	C#	-13.678	major	0.0323	0.617	1.67e-4	0.221	0.246	93.888	181667	4	C# major
1973	Peppino Di Capri	Un grande amore e niente più	io lontano da te pescatore lontano dal mare io chiedo da bere a una fonte asciugata dal sole solitudine e malinconia i soprammobili di casa mia qualche libro una poesia e sul piano una fotografia io e te un grande amore e niente più io e te le nostre corse fin laggiù là dove c'e la capanna scoperta da noi dove tu mi dicesti vorrei amore vorrei stasera vorrei notti notti d'amore nel silenzio il tuo nome il mio nome ma non risale l'acqua nel fiume nemmeno il tuo amore ritorna da me solitudine e malinconia in ogni angolo in ogni via ti rimprovero una sola cosa che potevi almeno dirmi scusa io e te un grande amore e niente più io e te le nostre corse fin laggiù là dove c'è la capanna scoperta da noi dove tu mi dicesti vorrei amore vorrei stasera vorrei io e te	0	Festival di Sanremo: Tutte le canzoni vincitrici (All Winners)	https://mosaic.scdn.co/640/84dfa22bd88d33fcb4dbae6c7464ec3d3ed5e87db7dc55c8d03f0d69ac26609c205b314714dfd087e39a814b141f80791d27af68a41f8e4b6c84bdf4f18d8f92e925c89caacf65f51925c0a69412abb2	Un Grande Amore E Niente Più	23jtJJJHw9lJecTueJzWqm	Peppino Di Capri	Collection - Se Non E' Amore	https://i.scdn.co/image/7b5aa41f7bd9e500562dfa893e37513cc1f2f3e7	3	0.504	0.445	E	-11.479	minor	0.0274	0.543	0	0.186	0.325	108.621	193573	4	E minor
1974	Iva Zanicchi	Ciao cara come stai?	Insieme agli altri lui perde sempre ha perso anche con lei Ladro e poeta ah ah anche in amore lui no non cambia ma-a-a-ai Quando la sera tornava a casa sconfitto più che mai lei lo guardava ah ah lui non capiva pagava solo lei Ciao cara come stai? Lei non risponde più Ciao cara come stai? Lei non lo guarda più muore la speranza è vuota la sua stanza Ciao cara come stai? Non gli ha creduto più Ora sei vinto tu sarai solo quando ti pentirai l'ultimo sbaglio oh oh piega l'orgoglio ma è troppo tardi orma-a-a-ai Senza ragione senza rancore cede al destino lui ed ogni sera ah ah tornando a casa parla a una sedia ormai Ciao cara come stai? Lei non risponde più Ciao cara come stai? Lei non lo guarda più Muore la speranza è vuota la sua stanza Ciao cara come stai? Non gli ha creduto più Ciao cara come stai? Lei non risponde più Ciao cara come stai? Lei non lo guarda più Muore la speranza è vuota la sua stanza Ciao cara come stai? Non gli ha creduto... più	1	Festival di Sanremo: Tutte le canzoni vincitrici (All Winners)	https://mosaic.scdn.co/640/84dfa22bd88d33fcb4dbae6c7464ec3d3ed5e87db7dc55c8d03f0d69ac26609c205b314714dfd087e39a814b141f80791d27af68a41f8e4b6c84bdf4f18d8f92e925c89caacf65f51925c0a69412abb2	Ciao cara come stai	6HbX7iRGsPrPhitaPJJzmP	Iva Zanicchi	Italian Classics: Iva Zanicchi Collection, Vol. 2	https://i.scdn.co/image/f688f6006c3c79153c7fc8a13383d3b996ce16dd	7	0.357	0.39	F#	-6.658	minor	0.0279	0.645	0	0.0762	0.487	95.744	236907	4	F# minor
1978	Matia Bazar	…e dirsi ciao!	se il sole da lassu' di colpo tinge il blu di buio e se ne va e se il mare azzurro ritmo non ha piu' e onda dopo onda rubera' la spiaggia della mia felicita' e poi se il vento che cantava insieme a noi stonate queste note soffiera' vuol dire separarci e dirsi ciao ma se l'alba spunta e poi anticipando in noi il giorno che verra' e se una rondine dispersa il sole avra' la forza della sua comunita' per continuare il viaggio fino al sud e poi se il fuoco del camino brillera' per sempre con amore e senza eta' vuol dire ritrovarsi e dirsi ciao	0.6666666666666666	Festival di Sanremo: Tutte le canzoni vincitrici (All Winners)	https://mosaic.scdn.co/640/84dfa22bd88d33fcb4dbae6c7464ec3d3ed5e87db7dc55c8d03f0d69ac26609c205b314714dfd087e39a814b141f80791d27af68a41f8e4b6c84bdf4f18d8f92e925c89caacf65f51925c0a69412abb2	E dirsi ciao - 2011 - Remaster;	1WDq68GSnceTftxZRfdz7n	Matia Bazar	Fantasia: Best & rarities	https://i.scdn.co/image/b2724bc153405bff84310660930310caf48d9b09	10	0.452	0.466	E	-8.596	major	0.0522	0.561	0.00129	0.122	0.402	118.668	286827	4	E major
1985	Ricchi e Poveri	Se m’innamoro	In questo inverno sotto zero  Come un film in bianco e nero  Se mi innamoro  Metto il maglione e vado fuori  Col pennello e coi colori  E lo coloro  E poi ti porto dove vuoi tu  Un po' più in alto un po' più su  Dove nessuno ci troverà  Su nell'immensità  Se mi innamoro devo fare  Qualche cosa di speciale Pensando a te aprire il cielo per scoprire  Dove il sole va a dormire e darlo a te  E voglio dire a chi non lo sa  Che so cos'è la felicità  Se m'innamoro ma poi perché   Continuo a dire se  Se m'innamoro, se m'innamoro  Se m'innamoro sarà di te  E canterò come canti tu  E ti darò qualche cosa in più  Se mi innamoro dentro di me  Darò la colpa a te  Ma guarda il mondo come è strano  Si stupisce se ti dico che ti amo  Ma se ci togli anche l'amore  Dopo averci tolto tutto, dove andiamo?  L'amore viene l'amore va  Senza l'amore come si fa  Ma se hai paura fai come me  Metti davanti un se  Se mi innamoro se mi innamoro  Se mi innamoro sarà di te	0.5	Festival di Sanremo: Tutte le canzoni vincitrici (All Winners)	https://mosaic.scdn.co/640/84dfa22bd88d33fcb4dbae6c7464ec3d3ed5e87db7dc55c8d03f0d69ac26609c205b314714dfd087e39a814b141f80791d27af68a41f8e4b6c84bdf4f18d8f92e925c89caacf65f51925c0a69412abb2	Se m'innamoro	6Pm5m45fMlLOJ8pKBHKzSc	Ricchi E Poveri	Greatest Hits	https://i.scdn.co/image/f7ab9fe39aeea6e92992814e7550a85ff3276561	27	0.776	0.537	B	-11.703	minor	0.031	0.145	5.76e-6	0.0887	0.677	111.975	204707	4	B minor
1988	Massimo Ranieri	Perdere l’amore	e adesso andate via voglio restare solo con la malinconia volare nel suo cielo non chiesi mai chi eri perchè scegliesti me me che fino ad ieri credevo fossi un re perdere l'amore quando si fa sera quando tra i capelli un pò d'argento li colora rischi di impazzire può scoppiarti il cuore perdere una donna e avere voglia di morire lasciami gridare rinnegare il cielo prendere a sassate tutti i sogni ancora in volo li farò cadere ad uno ad uno spezzerò le ali del destino e ti avrò vicino comunque ti capisco e ammetto che sbagliavo facevo le tue scelte chissà che pretendevo e adesso che rimane di tutto il tempo insieme un uomo troppo solo che ancora ti vuol bene perdere l'amore quando si fa sera quando sopra al viso c'è una ruga che non c'era provi a ragionare fai l'indifferente fino a che ti accorgi che non sei servito a niente e vorresti urlare soffocare il cielo sbattere la testa mille volte contro il muro respirare forte il suo cuscino dire è tutta colpa del destino se non ti ho vicino perdere l'amore maledetta sera e raccogli i cocci di una vita immaginaria pensi che domani è un giorno nuovo ma ripeti non me l'aspettavo non me l'aspettavo prendere a sassate tutti i sogni ancora in volo li farò cadere ad uno ad uno spezzerò le ali del destino e ti avrò vicino perdere l'amore	0.5	Festival di Sanremo: Tutte le canzoni vincitrici (All Winners)	https://mosaic.scdn.co/640/84dfa22bd88d33fcb4dbae6c7464ec3d3ed5e87db7dc55c8d03f0d69ac26609c205b314714dfd087e39a814b141f80791d27af68a41f8e4b6c84bdf4f18d8f92e925c89caacf65f51925c0a69412abb2	Perdere L'amore	2xgQvq4WuBX9DLmPkeBQ3M	Massimo Ranieri	I Successi Di Massimo Ranieri	https://i.scdn.co/image/ece19eb4349dc27ae1450b8d9c8f98e74d2c258f	31	0.394	0.533	E	-9.648	major	0.0393	0.474	1.42e-6	0.19	0.422	134.955	251533	4	E major
1997	Jalisse	Fiumi di parole	ah ah ah ah ah ah ah ah ah ah ah ah  Mi aspetto mille scuse  come sempre da te  sei un fiume di parole  dove anneghi anche me  che bravo che sei  ma questo linguaggio da talk show  cosa centra con noi.  Provo l'unico rimedio  che adotto da un po'  la mia testa chiude l'audio  la storia la so.  Sei fatto così  dovrei limitarmi oramai  a dirti di sì  Fiumi di parole  fiumi di parole tra noi  prima o poi ci portano via  ti darò il mio cuore  ti darò il mio cuore se vuoi  se puoi ora parla con lui  ora parla con lui.  Tu che gridi in un dialetto  che non piu' è il mio  io che perdo il tuo rispetto  sarebbe meglio un addio  è come in un film   il classico film dove lei  farà la pazzia  Fiumi di parole  fiumi di parole tra noi  prima o poi ci portano via  ti darò il mio cuore  ti darò il mio cuore se vuoi  se puoi ora parla con lui  Vorrei fermare un'immagine  sentirla entrare dentro di me  un tuo silenzio più complice  vorrei.  Fiumi di parole, fiumi di parole  prima o poi ci portano via  ti darò il mio cuore  ti darò il mio cuore se vuoi  se puoi ora parla con lui  Fiumi di parole  fiumi di parole tra noi  prima o poi ci portano via  ti darò il mio cuore  ti darò il mio cuore se vuoi  se puoi ora parla con lui  ora parla con lui  ah ah ah ah  Fiumi di parole  fiumi di parole tra noi  prima o poi ci portano via  Fiumi di parole	1	Festival di Sanremo: Tutte le canzoni vincitrici (All Winners)	https://mosaic.scdn.co/640/84dfa22bd88d33fcb4dbae6c7464ec3d3ed5e87db7dc55c8d03f0d69ac26609c205b314714dfd087e39a814b141f80791d27af68a41f8e4b6c84bdf4f18d8f92e925c89caacf65f51925c0a69412abb2	Fiumi Di Parole	5ZS9fcqcYtfL80rj1bf7Lb	Jalisse	Siedi E Ascolta	https://i.scdn.co/image/7b05b805de17c9300f5cb1f60dc1987f7e16b265	33	0.532	0.751	E	-7.242	minor	0.0458	0.461	0	0.0827	0.737	179.98	231733	4	E minor
1998	Annalisa Minetti	Senza te o con te	"Cerco sulla radio  la mia ""onda del cuore""  gioco col mio gatto  per sentire rumore  sono solo attimi...    Proprio difficili  Sola in questa stanza  grigia senza colori  laura sta cantando  storie di strani amori  sono solo attimi  proprio difficili  Ti cerco nei miei  mille pensieri  Ricordi com'eri  ti perdo  e non ti ho avuto mai  Senza te  Sento che  la mia vita  è difficile ma  non è finita  in salita lo so  penso che ce la farò  senza te  o con te  io volerò  senza te  sento che  la mia vita  è difficile ma  non è finita  qualche cosa farò  anche se poi sbaglierò  senza te  io volerò  Poi mi viene in mente  una fotografia  immagini sbiadite  della nostra allegria  sono solo attimi...  proprio difficili  Ti cerco nei miei mille pensieri  ricordi com'eri  ti perdo e non ti ho avuto mai  Senza te sento che  la mia vita  è difficile ma  non è finita  in salita lo so  penso che ce la farò  senza te o con te  io volerò  Qualche cosa farò  anche se poi sbaglierò  senza te o con te  io volerò  senza te... o con te"	1	Festival di Sanremo: Tutte le canzoni vincitrici (All Winners)	https://mosaic.scdn.co/640/84dfa22bd88d33fcb4dbae6c7464ec3d3ed5e87db7dc55c8d03f0d69ac26609c205b314714dfd087e39a814b141f80791d27af68a41f8e4b6c84bdf4f18d8f92e925c89caacf65f51925c0a69412abb2	Senza Te o con Te - Sanremo 1998	0R7PN6VlpaGnR59etZe1XH	Annalisa Minetti	Questo Piccolo Grande Amore	https://i.scdn.co/image/59fad2e53526a58b8083250af744c2342bc6789a	0	0.59	0.447	B	-7.092	major	0.0266	0.406	1.3e-6	0.102	0.198	74.979	253880	4	B major
2003	Alexia	Per dire di no	non è l'amore né la poesia che dà l'impulso qui nell'anima forse è il colore si di questi occhi tuoi che trafiggono il blu le incertezze e poi le illusioni che teniamo giù dentro di noi no non è un cielo di nostalgia che offusca il sole in te vulnerabile disarmato si e fragile perchè hai bisogno di me una volta in più non lo ammetti mai o non lo vuoi spiegare tu no non è un gioco della fantasia che ti ha portato qui domenica diventa musica la solitudine oh no e disperdo nel blu l'inquietudine le parole che non sento più dentro di noi per dire di no per dire vai via per dire dai resta qui va bene così per dire di no per dire vai via per dire dai resta qui va bene così non è l'amore mai nè la poesia che dà impulso qui nell'anima	1	Festival di Sanremo: Tutte le canzoni vincitrici (All Winners)	https://mosaic.scdn.co/640/84dfa22bd88d33fcb4dbae6c7464ec3d3ed5e87db7dc55c8d03f0d69ac26609c205b314714dfd087e39a814b141f80791d27af68a41f8e4b6c84bdf4f18d8f92e925c89caacf65f51925c0a69412abb2	Luce (Tramonti a Nord Est)	09g4hFrDdBK3J52I3InPgl	Elisa	Asile's World	https://i.scdn.co/image/5d09f29cc65214e566fbb76a9047f21f86d25506	44	0.645	0.626	F	-5.582	major	0.0788	0.268	0	0.0716	0.463	89.056	264533	4	F major
2002	Matia Bazar	Messaggio d’amore	voglio darti un messaggio d'amore di poche parole il segreto nascosto di un cuore un cuore che sa ho capito che forse l'errore non sei stato tu e con tutta la forza che ho dentro ti voglio di più ho ascoltato il rumore e il silenzio parlare nel tempo ho sognato il tuo viso i tuoi occhi sorridermi un po' quanta nostalgia tu mai non ti ho avuto mai in fondo mai dolce amore mio sensibile credimi mai non ti ho avuto mai che male fa non sentirti più sia quel che sia questo messaggio d'amore per te se ho posato le mani su sguardi bruciati dal mare e ho scalato le dune del cuore più alte di me se ho vissuto le notti sprecando la mia fantasia è perché ero sola confusa smarrita io mai non ti ho avuto mai in fondo mai dolce amore mio sensibile credimi mai proprio mai non ti ho avuto mai anima mia sai che ci sarò porta con te questo messaggio d'amore mai non ti ho avuto mai mai proprio mai non ti ho avuto mai in fondo mai dolce amore mio lascia che sia solo un messaggio d'amore un messaggio d'amore dovunque andrai sempre dovunque andrai	0.6666666666666666	Festival di Sanremo: Tutte le canzoni vincitrici (All Winners)	https://mosaic.scdn.co/640/84dfa22bd88d33fcb4dbae6c7464ec3d3ed5e87db7dc55c8d03f0d69ac26609c205b314714dfd087e39a814b141f80791d27af68a41f8e4b6c84bdf4f18d8f92e925c89caacf65f51925c0a69412abb2	Messaggio D'Amore	157ZzylmZsjQWXm8TSDkWL	Matia Bazar	Messaggi Dal Vivo	https://i.scdn.co/image/e39463d59eb94fa7b135e38cb6dc524841cc5b19	0	0.734	0.512	B	-7.695	major	0.0289	0.154	0	0.107	0.648	116.47	247533	4	B major
2004	Marco Masini	L’uomo volante	se ti avessi lo sai capirei la mia vita scoprendo dentro di me con il senno di poi che ogni scelta sbagliata mi conduceva da te così mi immagino già il tuo sorriso e vedo accendersi noi allo stadio in un bar in un gesto affettuoso che non ci capita mai vorrei regalarti un cielo d'agosto che fa da cornice a una stella che va un sole nascosto che nasce da dentro e disegna il confine della tua libertà quel suono leggero di un nome importante le ali di un uomo volante per non nasconderti mai dentro ai rimproveri miei e se tu fossi qui avrei anche il coraggio d'innamorarmi di te per parlarti così come infatti già faccio anche se non mi ascolterai però saresti il mio unico orgoglio la rondine che torna da sé vorrei regalarti un mondo diverso che ha fatto la pace con la sua crudeltà quel giusto rimorso che nasce sbagliando e conferma la forza di ogni fragilità l'anarchico istinto di un cuore migrante le ali di un uomo volante per arrivare più su e cercare la tua margherita di questa piccola vita dove più vero sei tu evitando ogni strada sbagliata io vorrei regalarti l'infinito che dà quel tenero abbraccio di un padre sognante che come un uomo volante anche se tu non verrai saprà nel cuore chi sei io questo spero e vorrei	0	Festival di Sanremo: Tutte le canzoni vincitrici (All Winners)	https://mosaic.scdn.co/640/84dfa22bd88d33fcb4dbae6c7464ec3d3ed5e87db7dc55c8d03f0d69ac26609c205b314714dfd087e39a814b141f80791d27af68a41f8e4b6c84bdf4f18d8f92e925c89caacf65f51925c0a69412abb2	L'Uomo Volante	5qdeseBpU31NBAlySaaRMk	Marco Masini	Masini	https://i.scdn.co/image/39116a83fa010d0fd2cdc54cec9defd85be6f865	0	0.534	0.641	A	-5.565	major	0.0255	0.459	0	0.318	0.325	87.13	235493	4	A major
2006	Povia	Vorrei avere il becco	"vorrei avere il becco per accontentarmi delle briciole concentrato e molto attento si ma con la testa fra le nuvole capire i sentimenti quando nascono e quando muoiono perciò vorrei avere i sensi per sentire il pericolo se tutti quanti lo sanno ma hanno paura che l'amore è un inganno oh ce l'ha fatta mia nonna per anni con mio nonno in campagna più o meno come fa un piccione lo so che e brutto il paragone però vivrei con l'emozione di dare fiducia a chi mi tira il pane più o meno come fa un piccione l'amore sopra il cornicione ti starei vicino nei momenti di crisi e lontano quando me lo chiedi dimmi che ci credi e che ti fidi un giorno avevo il vento che mi accompagnava su una tegola a volte sono solo e mi spavento cosa cì fanno due piccioni in una favola se tutti quanti lo sanno ma hanno paura che l'amore è un inganno oh me l'ha detto mia nonna "" lo sai quante volte non pensavo a tuo nonno"" più o meno come fa un piccione e mica come le persone che a causa dei particolari mandano per aria sogni e grandi amori camminerò come un piccione a piedi nudi sull'asfalto chi guida crede che mi mette sotto ma io con un salto all'ultimo momento volerò ma non troppo in alto perché il segreto è volare basso e un piccione vola basso ma è per questo che ti fa un dispetto ma è per questo che anche io non lo sopporto noi però alla fine resteremo insieme più o meno come fa un piccione l'amore sopra il cornicione ti starò vicino nei momenti di crisi e lontano quando me lo chiedi dimmi che ci credi ci sveglieremo la mattina due cuori sotto una campana"	0	Festival di Sanremo: Tutte le canzoni vincitrici (All Winners)	https://mosaic.scdn.co/640/84dfa22bd88d33fcb4dbae6c7464ec3d3ed5e87db7dc55c8d03f0d69ac26609c205b314714dfd087e39a814b141f80791d27af68a41f8e4b6c84bdf4f18d8f92e925c89caacf65f51925c0a69412abb2	Vorrei Avere Il Becco	7gHSbG6fFD8tuMoAWNWqoI	Povia	"I Bambini Fanno ""Ooh…"" La Storia Continua"	https://i.scdn.co/image/361fd6e024d591e49e05f44ee3dc46f4865203ca	0	0.64	0.692	B	-5.997	major	0.0403	0.577	0	0.236	0.756	151.965	178733	4	B major
2007	Simone Cristicchi	Ti regalerò una rosa	ti regalerò una rosa una rosa rossa per dipingere ogni cosa una rosa per ogni tua lacrima da consolare e una rosa per poterti amare ti regalerò una rosa una rosa bianca come fossi la mia sposa una rosa bianca che ti serva per dimenticare ogni piccolo dolore mi chiamo antonio e sono matto sono nato nel ' e vivo qui da quando ero bambino credevo di parlare col demonio così mi hanno chiuso quarant'anni dentro a un manicomio ti scrivo questa lettera perché non so parlare perdona la calligrafia da prima elementare e mi stupisco se provo ancora un'emozione ma la colpa è della mano che non smette di tremare io sono come un pianoforte con un tasto rotto l'accordo dissonante di un'orchestra di ubriachi e giorno e notte si assomigliano nella poca luce che trafigge i vetri opachi me la faccio ancora sotto perché ho paura per la società dei sani siamo sempre stati spazzatura puzza di piscio e segatura questa è malattia mentale e non esiste cura ti regalerò una rosa una rosa rossa per dipingere ogni cosa una rosa per ogni tua lacrima da consolare e una rosa per poterti amare ti regalerò una rosa una rosa bianca come fossi la mia sposa una rosa bianca che ti serva per dimenticare ogni piccolo dolore i matti sono punti di domanda senza frase migliaia di astronavi che non tornano alla base sono dei pupazzi stesi ad asciugare al sole i matti sono apostoli di un dio che non li vuole mi fabbrico la neve col polistirolo la mia patologia è che son rimasto solo ora prendete un telescopio… misurate le distanze e guardate tra me e voi… chi è più pericoloso dentro ai padiglioni ci amavamo di nascosto ritagliando un angolo che fosse solo il nostro ricordo i pochi istanti in cui ci sentivamo vivi non come le cartelle cliniche stipate negli archivi dei miei ricordi sarai l'ultimo a sfumare eri come un angelo legato ad un termosifone nonostante tutto io ti aspetto ancora e se chiudo gli occhi sento la tua mano che mi sfiora ti regalerò una rosa una rosa rossa per dipingere ogni cosa una rosa per ogni tua lacrima da consolare e una rosa per poterti amare ti regalerò una rosa una rosa bianca come fossi la mia sposa una rosa bianca che ti serva per dimenticare ogni piccolo dolore mi chiamo antonio e sto sul tetto cara margherita son vent'anni che ti aspetto i matti siamo noi quando nessuno ci capisce quando pure il tuo migliore amico ti tradisce ti lascio questa lettera adesso devo andare perdona la calligrafia da prima elementare e ti stupisci che io provi ancora un'emozione sorprenditi di nuovo perché antonio sa volare	0	Festival di Sanremo: Tutte le canzoni vincitrici (All Winners)	https://mosaic.scdn.co/640/84dfa22bd88d33fcb4dbae6c7464ec3d3ed5e87db7dc55c8d03f0d69ac26609c205b314714dfd087e39a814b141f80791d27af68a41f8e4b6c84bdf4f18d8f92e925c89caacf65f51925c0a69412abb2	Ti Regalero' Una Rosa	6ElESrhqjS1PJDDOMTotYe	Various Artists	Hit Estate 2007	https://i.scdn.co/image/e27528ca817c12e1d5af151fd3908d887499667e	0	0.519	0.658	B	-8.199	minor	0.0549	0.447	3.18e-6	0.119	0.807	169.774	231813	4	B minor
